{
  "packet_id": "SP-compass_artifact_wf-f678b42a-32e6-4c77-b539-89b40c493fbb_text_markdown-001",
  "source_id": "SRC-compass_artifact_wf-f678b42a-32e6-4c77-b539-89b40c493fbb_text_markdown-001",
  "source_title": "Opinion Hotmart",
  "source_type": "seller_forum",
  "source_ref": "https://bigbangconversion.com/blog/opinion-hotmart",
  "source_date_if_available": "20 de junio de 2023",
  "author_or_actor_if_available": null,
  "retrieval_method": "deep_search",
  "retrieved_from": "compass_artifact_wf-f678b42a-32e6-4c77-b539-89b40c493fbb_text_markdown",
  "raw_search_context": null,
  "snippets": [
    {
      "snippet_id": "SNP-001",
      "snippet_text": "\"Tienes que retirar tu saldo en dólares. Antes solo estaba en euros y ahora en dólares. No sé. Esto te hace pasar dos veces por la conversión de la moneda (de la moneda del comprador hasta la de Hotmart, y desde la de Hotmart a la tuya), por lo que se pierde un porcentaje de ingresos que puede ser elevado si focalizas tus ventas mayoritariamente en los países latinoamericanos.\"",
      "context_before": null,
      "context_after": null,
      "location_pointer": {
        "pointer_type": "url",
        "pointer_value": "https://bigbangconversion.com/blog/opinion-hotmart"
      }
    },
    {
      "snippet_id": "SNP-002",
      "snippet_text": "\"hola! ingresas los dolares a traves de payoneer, retiras por financiera ya sea en billete dolar)para despues cambiar y vender tu antojo) o en pesos. Si es en pesos la misma financiera te los puede depositar a tu cuenta bancaria o si no vos te los depositas por el cajero. Despues facturas tu monotributo normalmente y listo, todo blanqueado.\"",
      "context_before": null,
      "context_after": null,
      "location_pointer": {
        "pointer_type": "url",
        "pointer_value": "https://bigbangconversion.com/blog/opinion-hotmart"
      }
    },
    {
      "snippet_id": "SNP-003",
      "snippet_text": "\"Hola Javi , soy de Argentina , monotributista mi cuenta de banco es tanto en pesos como en dolar , ,lei que el pago es en dolar? , acá es un problema ingresar dolares a la cuenta , ya que AFIP nos controla en la compra de esa moneda ,,, como seriaseste sistema para Argentina?\"",
      "context_before": null,
      "context_after": null,
      "location_pointer": {
        "pointer_type": "url",
        "pointer_value": "https://bigbangconversion.com/blog/opinion-hotmart"
      }
    }
  ],
  "intake_notes": [
    "Derived from Part 2 provisional findings; stage 2 must downgrade traceability_status to weak, add snippet_needs_reopen to uncertainties, and cap priority_for_source_first at medium.",
    "URL also appears in other shards: compass_artifact_wf-a714e31c-2e2c-4735-a50c-9e9535323a2c_text_markdown. Packet assigned to this shard by alphabetical order."
  ],
  "possible_subjects": [
    "Blog comments section (June 20, 2023) on Hotmart user experience: (1) Hotmart payouts in USD (changed from EUR) causing double currency conversion loss for Latin American sellers; (2) Argentine seller describes Payoneer USD withdrawal workflow via local financial institutions; (3) Argentine monotributista reports difficulty receiving USD income due to AFIP currency purchase controls"
  ],
  "possible_actor_levels": ["seller"],
  "possible_metric_types": ["payout", "payout_method_availability"],
  "possible_time_scopes": ["2023-Q2"],
  "possible_geographies": ["AR"],
  "uncertainties": ["snippet_needs_reopen", "context_insufficient"],
  "priority_for_source_first": "medium",
  "traceability_status": "weak"
}
