{
  "packet_id": "SP-gumroad_d1_catalogo_dg_output-004",
  "source_id": "SRC-gumroad_d1_catalogo_dg_output-004",
  "source_title": "Gumroad Discover",
  "source_type": "search_results_page",
  "source_ref": "https://gumroad.com/discover",
  "source_date_if_available": "Accessed April 2026; page undated",
  "author_or_actor_if_available": null,
  "retrieval_method": "deep_search",
  "retrieved_from": "gumroad_d1_catalogo_dg_output",
  "raw_search_context": null,
  "snippets": [
    {
      "snippet_id": "SNP-001",
      "snippet_text": "\"Browse over 1.6 million free and premium digital products in education, tech, design, and more categories from Gumroad creators and online entrepreneurs.\"",
      "context_before": null,
      "context_after": null,
      "location_pointer": {
        "pointer_type": "url",
        "pointer_value": "https://gumroad.com/discover"
      }
    }
  ],
  "possible_subjects": [
    "Gumroad catalog size",
    "Gumroad Discover platform"
  ],
  "possible_actor_levels": ["marketplace"],
  "possible_metric_types": ["unknown"],
  "possible_time_scopes": ["current as of April 2026"],
  "possible_geographies": null,
  "uncertainties": ["snippet_needs_reopen", "source_date_unclear", "metric_type_unclear"],
  "priority_for_source_first": "low",
  "intake_notes": [
    "Derived from Part 2 provisional findings; stage 2 must downgrade traceability_status to weak, add snippet_needs_reopen to uncertainties, and cap priority_for_source_first at medium.",
    "source_title null in stage 1 skeleton; inferred from URL path by stage 2 converter.",
    "1.6 million products is a catalog count — no enum value covers 'product catalog size'; captured as unknown with metric_type_unclear. Page meta description, may be outdated."
  ],
  "traceability_status": "weak"
}
