{
  "packet_id": "SP-compass_artifact_wf-ff9eedd9-5f17-49fb-9226-4a8afea39903_text_markdown_normalized-018",
  "source_id": "SRC-compass_artifact_wf-ff9eedd9-5f17-49fb-9226-4a8afea39903_text_markdown_normalized-018",
  "source_title": "Gumroad Alternative",
  "source_type": "article",
  "source_ref": "https://www.lemonsqueezy.com/gumroad-alternative",
  "source_date_if_available": "Accessed April 2026; page undated",
  "author_or_actor_if_available": null,
  "retrieval_method": "deep_search",
  "retrieved_from": "compass_artifact_wf-ff9eedd9-5f17-49fb-9226-4a8afea39903_text_markdown_normalized",
  "raw_search_context": null,
  "snippets": [
    {
      "snippet_id": "SNP-001",
      "snippet_text": "\"We provide all-inclusive pricing of 5% + 50¢ per transaction. We'd say that's pretty competitive compared with Gumroad.\"",
      "context_before": null,
      "context_after": null,
      "location_pointer": {
        "pointer_type": "url",
        "pointer_value": "https://www.lemonsqueezy.com/gumroad-alternative"
      }
    }
  ],
  "intake_notes": [
    "URL also appears in other shards: compass_artifact_wf-f51aad3f-6ad1-4ebb-9cb3-cdab05234caa_text_markdown. Packet assigned to this shard by alphabetical order."
  ],
  "possible_subjects": [
    "Lemon Squeezy Gumroad-alternative marketing page (accessed April 2026, undated): Lemon Squeezy all-inclusive pricing 5% + $0.50 per transaction; positioned as competitive alternative to Gumroad"
  ],
  "possible_actor_levels": ["seller", "marketplace"],
  "possible_metric_types": ["fee_rate"],
  "possible_time_scopes": ["2026-Q2"],
  "possible_geographies": null,
  "uncertainties": ["source_date_unclear", "context_insufficient", "current_vs_historical_ambiguity"],
  "priority_for_source_first": "low",
  "traceability_status": "weak"
}
