{
  "packet_id": "SP-compass_artifact_wf-b66489b8-52e0-4cd3-9bfd-9810fa4ba897_text_markdown_normalized-044",
  "source_id": "SRC-compass_artifact_wf-b66489b8-52e0-4cd3-9bfd-9810fa4ba897_text_markdown_normalized-044",
  "source_title": "Integrations",
  "source_type": "database_profile",
  "source_ref": "https://zapier.com/apps/payhip/integrations",
  "source_date_if_available": "Accessed April 2026; page undated",
  "author_or_actor_if_available": null,
  "retrieval_method": "deep_search",
  "retrieved_from": "compass_artifact_wf-b66489b8-52e0-4cd3-9bfd-9810fa4ba897_text_markdown_normalized",
  "raw_search_context": null,
  "snippets": [
    {
      "snippet_id": "SNP-001",
      "snippet_text": "\"Instantly connect Payhip with the apps you use everyday. Payhip integrates with 8,000 other apps on Zapier - it's the easiest way to automate your work.\"",
      "context_before": null,
      "context_after": null,
      "location_pointer": {
        "pointer_type": "url",
        "pointer_value": "https://zapier.com/apps/payhip/integrations"
      }
    }
  ],
  "intake_notes": [
    "Derived from Part 2 provisional findings; stage 2 must downgrade traceability_status to weak, add snippet_needs_reopen to uncertainties, and cap priority_for_source_first at medium."
  ],
  "possible_subjects": [
    "Zapier integration page (accessed April 2026): Payhip integrates with 8,000 apps on Zapier"
  ],
  "possible_actor_levels": [
    "seller"
  ],
  "possible_metric_types": [
    "unknown"
  ],
  "possible_time_scopes": [],
  "possible_geographies": null,
  "uncertainties": [
    "snippet_needs_reopen",
    "source_date_unclear",
    "context_insufficient"
  ],
  "priority_for_source_first": "low",
  "traceability_status": "weak"
}