{
  "packet_id": "SP-compass_artifact_wf-b66489b8-52e0-4cd3-9bfd-9810fa4ba897_text_markdown_normalized-017",
  "source_id": "SRC-compass_artifact_wf-b66489b8-52e0-4cd3-9bfd-9810fa4ba897_text_markdown_normalized-017",
  "source_title": "Blog",
  "source_type": "blog",
  "source_ref": "https://payhip.com/blog",
  "source_date_if_available": "April 2026",
  "author_or_actor_if_available": null,
  "retrieval_method": "deep_search",
  "retrieved_from": "compass_artifact_wf-b66489b8-52e0-4cd3-9bfd-9810fa4ba897_text_markdown_normalized",
  "raw_search_context": null,
  "snippets": [
    {
      "snippet_id": "SNP-001",
      "snippet_text": "- \"5 Amazon KDP Alternatives for Self-Published Authors\" — Nicole Martins Ferreira, April 9, 2026\n- \"5 Sellfy Alternatives That Are Clearly Better Replacements\" — Nicole Martins Ferreira, April 8, 2026\n- \"6 Selly Alternatives for Selling Online in 2026\" — Nicole Martins Ferreira, April 7, 2026\n- \"Payhip Vs Etsy: Which is Better in 2026?\" — Nicole Martins Ferreira, April 7, 2026\n- \"6 Lemon Squeezy Alternatives for Selling Digital Products\" — Nicole Martins Ferreira, April 6, 2026\n- \"Top Ebook Topic Ideas in 2026: What do readers want?\" — Abs @ Payhip, April 2, 2026",
      "context_before": null,
      "context_after": null,
      "location_pointer": {
        "pointer_type": "url",
        "pointer_value": "https://payhip.com/blog"
      }
    }
  ],
  "intake_notes": [],
  "possible_subjects": [
    "Payhip blog recent posts April 2026: articles include comparisons to Amazon KDP, Sellfy, Selly, Lemon Squeezy, and Etsy; ebook topic guidance; published April 2-9, 2026"
  ],
  "possible_actor_levels": ["marketplace"],
  "possible_metric_types": ["unknown"],
  "possible_time_scopes": ["2026-Q2"],
  "possible_geographies": null,
  "uncertainties": ["context_insufficient"],
  "priority_for_source_first": "low",
  "traceability_status": "partial"
}
