{
  "packet_id": "SP-compass_artifact_wf-fbf25436-287d-411c-be97-ee28c335a4a4_text_markdown-003",
  "source_id": "SRC-compass_artifact_wf-fbf25436-287d-411c-be97-ee28c335a4a4_text_markdown-003",
  "source_title": "Complaints",
  "source_type": "unknown",
  "source_ref": "https://www.bbb.org/us/ca/san-francisco/profile/ecommerce/gumroad-1116-448858/complaints",
  "source_date_if_available": "July 10, 2025 (complaint filed); charges on May 8 and June 5, 2025",
  "author_or_actor_if_available": null,
  "retrieval_method": "deep_search",
  "retrieved_from": "compass_artifact_wf-fbf25436-287d-411c-be97-ee28c335a4a4_text_markdown",
  "raw_search_context": null,
  "snippets": [
    {
      "snippet_id": "SNP-001",
      "snippet_text": "\"On May 31, 2025, I placed two separate orders totaling $900 through the Gumroad platform from the seller digitalebooks1. The seller promoted physical clothing merchandise via Instagram and instructed buyers to complete their orders through Gumroad. However, the invoices falsely labeled the purchases as digital books, even though I never received any digital content or the actual clothing products I paid for.\"",
      "context_before": null,
      "context_after": null,
      "location_pointer": {
        "pointer_type": "url",
        "pointer_value": "https://www.bbb.org/us/ca/san-francisco/profile/ecommerce/gumroad-1116-448858/complaints"
      }
    },
    {
      "snippet_id": "SNP-002",
      "snippet_text": "\"I purchased a digital product on Gumroad for approximately $200. The seller failed to deliver the product properly, and I could not access the content from the day of purchase. The link/pages were unavailable and did not function. I contacted the seller many times, but they stopped responding and provided no solution at all. I then contacted Gumroad support and provided full evidence, including screenshots, purchase receipts, and the entire message history. Gumroad repeatedly told me to contact the seller directly and refused to intervene, even though their own policy states that Gumroad may step in when a seller does not respond for 30 days.\"",
      "context_before": null,
      "context_after": null,
      "location_pointer": {
        "pointer_type": "url",
        "pointer_value": "https://www.bbb.org/us/ca/san-francisco/profile/ecommerce/gumroad-1116-448858/complaints"
      }
    },
    {
      "snippet_id": "SNP-003",
      "snippet_text": "\"I was charged twice for the same digital product once on May 8, 2025, and again on June 5, 2025. I contacted Gumroad Support immediately. On June 5, Gumroad Support confirmed the duplicate purchase and said the case would be escalated for review. On June 13, they replied again saying it was still under review. However, since then, I have received no further communication, and no refund has been issued.\"",
      "context_before": null,
      "context_after": null,
      "location_pointer": {
        "pointer_type": "url",
        "pointer_value": "https://www.bbb.org/us/ca/san-francisco/profile/ecommerce/gumroad-1116-448858/complaints"
      }
    }
  ],
  "intake_notes": [
    "Derived from Part 2 provisional findings; stage 2 must downgrade traceability_status to weak, add snippet_needs_reopen to uncertainties, and cap priority_for_source_first at medium.",
    "URL also appears in other shards: compass_artifact_wf-63c228bc-9037-4ba4-9569-3f62e8735192_text_markdown. Packet assigned to this shard by alphabetical order."
  ],
  "possible_subjects": [
    "BBB complaints page for Gumroad (most recent July 10, 2025; May-July 2025 events): (1) buyer reports $900 purchase where seller falsely labeled physical clothing as digital books with no delivery; (2) buyer reports inaccessible ~$200 digital product with Gumroad refusing to intervene despite stated 30-day non-response policy; (3) buyer reports duplicate charge in May/June 2025 with no refund after support confirmed the error"
  ],
  "possible_actor_levels": ["buyer", "seller", "marketplace"],
  "possible_metric_types": ["refund_policy"],
  "possible_time_scopes": ["2025-Q2", "2025-Q3"],
  "possible_geographies": null,
  "uncertainties": ["snippet_needs_reopen", "context_insufficient"],
  "priority_for_source_first": "medium",
  "traceability_status": "weak"
}
