{
  "packet_id": "SP-compass_artifact_wf-22c5fbd5-9e04-4d5a-9b0e-4cb97acec9cc_text_markdown_normalized-018",
  "source_id": "SRC-compass_artifact_wf-22c5fbd5-9e04-4d5a-9b0e-4cb97acec9cc_text_markdown_normalized-018",
  "source_title": "Behind The Scenes The Making Of An Online Course With Domestika",
  "source_type": "blog",
  "source_ref": "https://www.sketchlikeanarchitect.com/blog/behind-the-scenes-the-making-of-an-online-course-with-domestika",
  "source_date_if_available": "August 29, 2022",
  "author_or_actor_if_available": null,
  "retrieval_method": "deep_search",
  "retrieved_from": "compass_artifact_wf-22c5fbd5-9e04-4d5a-9b0e-4cb97acec9cc_text_markdown_normalized",
  "raw_search_context": null,
  "snippets": [
    {
      "snippet_id": "SNP-001",
      "snippet_text": "\"Of course, I'm not allowed to discuss any exact amounts, but I can tell that there are 3 types of payments that teachers can be eligible for (as of the beginning of 2022): Advance fee: Usually, within a month from the production phase being over, teachers get paid the advance fee that were agreed on in the beginning when discussing the contract. Once the course is published and students start enrolling, teachers are basically earning back their advance fee. Royalties: Once the course earns the amount of the advance, teachers start to get paid royalties from any new enrollments. Affiliates: Some teachers are eligible to become Domestika affiliate partners.\"",
      "context_before": null,
      "context_after": null,
      "location_pointer": {
        "pointer_type": "url",
        "pointer_value": "https://www.sketchlikeanarchitect.com/blog/behind-the-scenes-the-making-of-an-online-course-with-domestika"
      }
    },
    {
      "snippet_id": "SNP-002",
      "snippet_text": "\"Because I'm based in Prague, Czech Republic, the closest studio for me was in Madrid, Spain. And Domestika generously covers the airfare & other travel expenses for teachers as well as the hotel and partly even the food. Moreover, the team was super professional, very committed to the process, and working hard to make the best possible course and actually to make me look good... Hands down this is such a fantastic, fantastic experience! Very grateful for it!\"",
      "context_before": null,
      "context_after": null,
      "location_pointer": {
        "pointer_type": "url",
        "pointer_value": "https://www.sketchlikeanarchitect.com/blog/behind-the-scenes-the-making-of-an-online-course-with-domestika"
      }
    }
  ],
  "possible_subjects": [
    "Domestika instructor compensation structure taxonomy",
    "Domestika course production logistics and instructor benefits"
  ],
  "possible_actor_levels": ["marketplace", "seller"],
  "possible_metric_types": ["payout", "fee_rate", "payout_method_availability"],
  "possible_time_scopes": ["early 2022", "August 2022"],
  "possible_geographies": ["Spain", "Czech Republic"],
  "uncertainties": ["current_vs_historical_ambiguity"],
  "priority_for_source_first": "high",
  "intake_notes": [
    "Blog post from sketchlikeanarchitect.com (David Drazil, Prague-based architecture/art instructor) published August 29, 2022. Clear taxonomy of Domestika instructor payment types as of early 2022: advance fee (paid within ~1 month of production), royalties (paid after advance is recouped from enrollments), affiliates (optional program for some instructors). NDA prevents exact amounts.",
    "SNP-002 documents that Domestika covers international travel (airfare, hotel, food) for instructors filming in Madrid.",
    "current_vs_historical_ambiguity: August 2022 baseline; compensation structure changed significantly since (advance → commission model shift, royalty declines documented in 2023-2025)."
  ],
  "traceability_status": "complete"
}
