{
  "packet_id": "SP-compass_artifact_wf-02711d62-b64f-4287-b85f-3f3a57c9da67_text_markdown-012",
  "source_id": "SRC-compass_artifact_wf-02711d62-b64f-4287-b85f-3f3a57c9da67_text_markdown-012",
  "source_title": "Search",
  "source_type": "search_results_page",
  "source_ref": "https://www.patreon.com/search",
  "source_date_if_available": "Accessed April 2026; page undated.",
  "author_or_actor_if_available": null,
  "retrieval_method": "deep_search",
  "retrieved_from": "compass_artifact_wf-02711d62-b64f-4287-b85f-3f3a57c9da67_text_markdown",
  "raw_search_context": null,
  "snippets": [
    {
      "snippet_id": "SNP-001",
      "snippet_text": "[Stated in layout: \"Art · Podcast · Music · Games · Writing · Photography\"]",
      "context_before": null,
      "context_after": null,
      "location_pointer": {
        "pointer_type": "url",
        "pointer_value": "https://www.patreon.com/search"
      }
    }
  ],
  "possible_subjects": [
    "Patreon content category navigation"
  ],
  "possible_actor_levels": ["marketplace"],
  "possible_metric_types": ["unknown"],
  "possible_time_scopes": ["undated"],
  "possible_geographies": null,
  "uncertainties": ["snippet_needs_reopen", "metric_type_unclear", "source_date_unclear", "context_insufficient"],
  "priority_for_source_first": "low",
  "intake_notes": [
    "Derived from Part 2 provisional findings; stage 2 must downgrade traceability_status to weak, add snippet_needs_reopen to uncertainties, and cap priority_for_source_first at medium.",
    "source_type = search_results_page forces priority_for_source_first to low (overrides Part 2 medium cap).",
    "Metric_type_unclear: snippet is a navigation tab list only. No metric is present. Captured as unknown.",
    "4 uncertainties flagged; needs_human_review. Reopen to determine if the search results page contains quantitative data (creator counts, revenue ranges) beyond category tabs."
  ],
  "traceability_status": "weak"
}
